{
  "schemaVersion": "1.0.0",
  "units": "m",
  "note": "外部の窓・ドアの配置インスタンス。type は data/door-catalog.json / data/window-catalog.json の type を参照する。face(N/S/E/W)+offset で位置を表す（offsetはその面に沿った建物ローカル座標の絶対値）。hingeSide/swingDirはドア(category:door)のみ意味を持つ。ブラウザの配置編集機能から書き出したファイル。data/openings.json に上書きしてコミットすること。",
  "items": [
    {
      "id": "op-001",
      "type": "door-entrance",
      "face": "N",
      "offset": 0.91,
      "level": 1,
      "hingeSide": "L",
      "swingDir": "out",
      "label": "民泊 玄関ドア",
      "status": "verified"
    },
    {
      "id": "op-002",
      "type": "window-waist",
      "face": "N",
      "offset": 3.5,
      "level": 1,
      "widthOverride": 1.76,
      "heightOverride": 1.03,
      "sillOverride": 1.2,
      "label": "民泊 北窓",
      "status": "verified"
    },
    {
      "id": "op-003",
      "type": "door-entrance",
      "face": "N",
      "offset": 9.54,
      "level": 1,
      "hingeSide": "L",
      "swingDir": "out",
      "label": "自宅 玄関ドア",
      "status": "verified"
    },
    {
      "id": "op-004",
      "type": "window-fixed-small",
      "face": "N",
      "offset": 11.05,
      "level": 1,
      "widthOverride": 0.71,
      "heightOverride": 1,
      "sillOverride": 1,
      "label": "土間 フィックス窓",
      "status": "estimated"
    },
    {
      "id": "op-005",
      "type": "window-fixed-high",
      "face": "N",
      "offset": 13.7,
      "level": 2,
      "widthOverride": 1.72,
      "heightOverride": 0.45,
      "sillOverride": 1.97,
      "label": "2階 階段北窓",
      "status": "verified"
    },
    {
      "id": "op-006",
      "type": "window-waist",
      "face": "S",
      "offset": 2.79,
      "level": 1,
      "widthOverride": 1.77,
      "heightOverride": 1.03,
      "sillOverride": 1.22,
      "label": "民泊 腰窓",
      "status": "verified"
    },
    {
      "id": "op-007",
      "type": "window-fixed-small",
      "face": "S",
      "offset": 5.66,
      "level": 1,
      "heightOverride": 0.56,
      "sillOverride": 1.69,
      "label": "民泊 小窓",
      "status": "verified"
    },
    {
      "id": "op-008",
      "type": "window-waist",
      "face": "S",
      "offset": 8.22,
      "level": 1,
      "widthOverride": 1.8,
      "heightOverride": 1.03,
      "label": "自宅 腰窓",
      "status": "verified"
    },
    {
      "id": "op-009",
      "type": "window-small",
      "face": "S",
      "offset": 10.01,
      "level": 1,
      "heightOverride": 0.96,
      "sillOverride": 1.29,
      "label": "自宅 小窓（西）",
      "status": "verified"
    },
    {
      "id": "op-010",
      "type": "window-full",
      "face": "S",
      "offset": 11.01,
      "level": 1,
      "label": "自宅LDK 掃き出し窓",
      "status": "verified"
    },
    {
      "id": "op-011",
      "type": "window-small",
      "face": "S",
      "offset": 14.04,
      "level": 1,
      "heightOverride": 0.96,
      "sillOverride": 1.29,
      "label": "自宅 小窓（東）",
      "status": "verified"
    },
    {
      "id": "op-012",
      "type": "window-waist",
      "face": "S",
      "offset": 13.68,
      "level": 2,
      "widthOverride": 1.57,
      "heightOverride": 0.96,
      "sillOverride": 1.32,
      "label": "2階 南窓①(子供部屋1)",
      "status": "verified"
    },
    {
      "id": "op-013",
      "type": "window-waist",
      "face": "S",
      "offset": 16.38,
      "level": 2,
      "widthOverride": 1.77,
      "heightOverride": 0.96,
      "sillOverride": 1.32,
      "label": "2階 南窓②(夫婦寝室)",
      "status": "verified"
    },
    {
      "id": "op-014",
      "type": "window-waist",
      "face": "E",
      "offset": 0.92,
      "level": 2,
      "widthOverride": 1.62,
      "heightOverride": 0.97,
      "sillOverride": 1.28,
      "label": "2階 東窓①(子供部屋2)",
      "status": "verified"
    },
    {
      "id": "op-015",
      "type": "window-waist",
      "face": "E",
      "offset": 3.75,
      "level": 2,
      "widthOverride": 1.46,
      "heightOverride": 0.97,
      "sillOverride": 1.28,
      "label": "2階 東窓②(夫婦寝室)",
      "status": "verified"
    },
    {
      "id": "op-016",
      "type": "window-fixed-high",
      "face": "E",
      "offset": 2.79,
      "level": 1,
      "widthOverride": 0.81,
      "heightOverride": 0.36,
      "sillOverride": 1.8,
      "label": "1階 東の細長窓",
      "status": "verified"
    },
    {
      "id": "op-017",
      "type": "door-louver",
      "face": "E",
      "offset": 6.41,
      "level": 1,
      "hingeSide": "L",
      "swingDir": "out",
      "label": "南土間 東のルーバー戸",
      "status": "verified"
    },
    {
      "id": "op-018",
      "type": "window-fixed-small",
      "face": "W",
      "offset": 1.95,
      "wallX": 12.74,
      "level": 2,
      "widthOverride": 0.65,
      "heightOverride": 0.6,
      "sillOverride": 1.86,
      "label": "2階 廊下西窓",
      "status": "verified"
    },
    {
      "id": "op-019",
      "type": "window-fixed-high",
      "face": "W",
      "offset": 3.2,
      "level": 1,
      "widthOverride": 0.85,
      "heightOverride": 0.35,
      "label": "洗面脱衣室 天井近くフィックス窓",
      "status": "verified"
    }
  ]
}